{
  "persona": {
    "id": "F-09",
    "condition": "diverse",
    "age": 26,
    "income_bracket": "intern stipend 12k",
    "location": "Minneapolis, MN",
    "diet": "low-sodium",
    "accessibility": "none",
    "goal": "Heart-healthy wings"
  },
  "run": {
    "history": [
      {
        "action": "wait",
        "selector": "<css>",
        "text": "",
        "ms": 1000
      }
    ]
  },
  "analysis": "# Persona Report\n\n### Persona Name\nF-09\n\n### Critical Issues\n1. **Dietary Restrictions**: The persona follows a low-sodium diet, which may limit options for heart-healthy wings. Finding suitable recipes or restaurant options that cater to this requirement is crucial.\n2. **Accessibility**: The persona has no reported accessibility features, which could hinder their ability to find or prepare heart-healthy meals.\n\n### Minor Friction\n1. **Waiting Time**: The persona experienced a delay (1000 ms) while waiting for information or options, indicating potential inefficiencies in the user experience when searching for heart-healthy recipes or restaurants.\n\n### Suggested Improvements\n1. **Recipe Database**: Create a dedicated section for low-sodium heart-healthy wing recipes, ensuring easy access and filtering options.\n2. **Accessibility Features**: Implement accessibility options on the platform, such as voice search or easy navigation for users with diverse needs.\n3. **Performance Optimization**: Reduce waiting times by optimizing the backend processes to enhance user experience when searching for dietary-specific options."
}